{"type": "config", "name": "custom_cnn_hpo", "metricName": "val_macro_f1", "metricUnit": "", "bestDirection": "higher"}
{"run": 1, "commit": "n/a", "metric": 0.941, "metrics": {}, "status": "keep", "description": "{'lr': 0.003, 'weight_decay': 0.0001, 'width': 48, 'dropout': 0.5, 'aug_strength': 1.0}", "timestamp": 1780872961, "segment": 0}
{"run": 2, "commit": "n/a", "metric": 0.9196, "metrics": {}, "status": "discard", "description": "{'lr': 0.003, 'weight_decay': 0.001, 'width': 24, 'dropout': 0.2, 'aug_strength': 0.5}", "timestamp": 1780872961, "segment": 0}
{"run": 3, "commit": "n/a", "metric": 0.9677, "metrics": {}, "status": "keep", "description": "{'lr': 0.0003, 'weight_decay': 0.001, 'width': 48, 'dropout': 0.2, 'aug_strength': 1.0}", "timestamp": 1780872961, "segment": 0}
{"run": 4, "commit": "n/a", "metric": 0.9308, "metrics": {}, "status": "discard", "description": "{'lr': 0.003, 'weight_decay': 1e-05, 'width': 48, 'dropout': 0.2, 'aug_strength': 1.0}", "timestamp": 1780872961, "segment": 0}
{"run": 5, "commit": "n/a", "metric": 0.9336, "metrics": {}, "status": "discard", "description": "{'lr': 0.003, 'weight_decay': 1e-05, 'width': 32, 'dropout': 0.2, 'aug_strength': 1.5}", "timestamp": 1780872961, "segment": 0}
{"run": 6, "commit": "n/a", "metric": 0.95, "metrics": {}, "status": "discard", "description": "{'lr': 0.0003, 'weight_decay': 0.001, 'width': 32, 'dropout': 0.3, 'aug_strength': 1.0}", "timestamp": 1780872961, "segment": 0}
{"run": 7, "commit": "n/a", "metric": 0.9448, "metrics": {}, "status": "discard", "description": "{'lr': 0.001, 'weight_decay': 0.0001, 'width': 32, 'dropout': 0.5, 'aug_strength': 1.5}", "timestamp": 1780872961, "segment": 0}
{"run": 8, "commit": "n/a", "metric": 0.9312, "metrics": {}, "status": "discard", "description": "{'lr': 0.003, 'weight_decay': 0.001, 'width': 32, 'dropout': 0.3, 'aug_strength': 1.5}", "timestamp": 1780872961, "segment": 0}
{"run": 9, "commit": "n/a", "metric": 0.9487, "metrics": {}, "status": "discard", "description": "{'lr': 0.001, 'weight_decay': 1e-05, 'width': 48, 'dropout': 0.2, 'aug_strength': 1.5}", "timestamp": 1780872961, "segment": 0}
{"run": 10, "commit": "n/a", "metric": 0.9687, "metrics": {}, "status": "keep", "description": "{'lr': 0.001, 'weight_decay': 1e-05, 'width': 24, 'dropout': 0.3, 'aug_strength': 0.5}", "timestamp": 1780872961, "segment": 0}
